{
  "$id": "lena_video_audio_plan_v1.schema.json", "$schema": "https://json-schema.org/draft/2020-12/schema", "type": "object", "additionalProperties": false,
  "required": ["schema_version", "artifact_type", "artifact_id", "property_id", "video_id", "governed_date", "created_at", "generator_version", "upstream_artifacts", "dialogue_mode", "dialogue_text", "voice_authority_required", "timing", "pronunciation", "lip_sync_required", "music", "diegetic_sound", "ambience", "sound_hierarchy", "mix_targets", "provider_neutral_requirements", "provider_prompt_cue"],
  "properties": {
    "schema_version": {"const": "lena_video_artifact_v1"}, "artifact_type": {"const": "lena_video_audio_plan_v1"}, "artifact_id": {"$ref": "common_defs_v1.schema.json#/$defs/artifact_id"}, "property_id": {"const": "lena"}, "video_id": {"$ref": "common_defs_v1.schema.json#/$defs/video_id"}, "governed_date": {"$ref": "common_defs_v1.schema.json#/$defs/governed_date"}, "created_at": {"$ref": "common_defs_v1.schema.json#/$defs/created_at"}, "generator_version": {"$ref": "common_defs_v1.schema.json#/$defs/slug"}, "upstream_artifacts": {"$ref": "common_defs_v1.schema.json#/$defs/upstream_artifacts"},
    "dialogue_mode": {"enum": ["none", "spoken"]}, "dialogue_text": {"type": "string", "maxLength": 500}, "voice_authority_required": {"type": "boolean"}, "timing": {"$ref": "common_defs_v1.schema.json#/$defs/nonempty_string"}, "pronunciation": {"$ref": "common_defs_v1.schema.json#/$defs/optional_string_list"}, "lip_sync_required": {"type": "boolean"}, "music": {"$ref": "common_defs_v1.schema.json#/$defs/nonempty_string"}, "diegetic_sound": {"$ref": "common_defs_v1.schema.json#/$defs/string_list"}, "ambience": {"$ref": "common_defs_v1.schema.json#/$defs/string_list"}, "sound_hierarchy": {"$ref": "common_defs_v1.schema.json#/$defs/string_list"}, "mix_targets": {"$ref": "common_defs_v1.schema.json#/$defs/string_list"}, "provider_neutral_requirements": {"$ref": "common_defs_v1.schema.json#/$defs/string_list"}, "provider_prompt_cue": {"$ref": "common_defs_v1.schema.json#/$defs/provider_prompt_cue"}
  }
}
